id,slug,name,price,imageUrls,description,category,tags,sizes,colors,rating,reviewCount,details,stock,affiliateUrl
1,the-minimalist-tee,The Minimalist Tee,45.00,"https://images.unsplash.com/photo-1576417677416-6ca3adfb5435?crop=entropy&cs=tinysrgb&fit=max&fm=jpg&ixid=M3w3NDE5ODJ8MHwxfHNlYXJjaHwzfHx3aGl0ZSUyMHQtc2hpcnR8ZW58MHx8fHwxNzU5MDIwMzA3fDA&ixlib=rb-4.1.0&q=80&w=1080,https://images.unsplash.com/photo-1643881080033-e67069c5e4df?crop=entropy&cs=tinysrgb&fit=max&fm=jpg&ixid=M3w3NDE5ODJ8MHwxfHNlYXJjaHw4fHx3aGl0ZSUyMHQtc2hpcnR8ZW58MHx8fHwxNzU5MDIwMzA3fDA&ixlib=rb-4.1.0&q=80&w=1080","A flawless essential, our Minimalist Tee is crafted from premium Pima cotton for a soft, breathable feel. Its classic crewneck and relaxed fit make it a versatile foundation for any outfit.","Essentials","New Arrival,Best Seller","XS,S,M,L,XL","Off-White:#FAFAF9,Soft Grey:#D1D5DB,Black:#111827",4.9,124,"100% Pima Cotton,Made in Portugal",100,https://example.com/product/minimalist-tee
2,city-chic-trench-coat,City-Chic Trench Coat,220.00,"https://images.unsplash.com/photo-1676716105765-e19fe6a01851?crop=entropy&cs=tinysrgb&fit=max&fm=jpg&ixid=M3w3NDE5ODJ8MHwxfHNlYXJjaHw0fHx0cmVuY2glMjBjb2F0fGVufDB8fHx8MTc1OTA3NTE3Mnww&ixlib=rb-4.1.0&q=80&w=1080,https://images.unsplash.com/photo-1578632292335-df3abbb0d586?crop=entropy&cs=tinysrgb&fit=max&fm=jpg&ixid=M3w3NDE5ODJ8MHwxfHNlYXJjaHw1fHxmYXNoaW9uJTIwbW9kZWx8ZW58MHx8fHwxNzU5MDQ0NTU4fDA&ixlib=rb-4.1.0&q=80&w=1080","The quintessential outerwear piece, updated for the modern wardrobe. Our City-Chic Trench features a water-resistant cotton blend, classic double-breasted closure, and a removable belt for a customized silhouette.","Womens","Featured","S,M,L","Beige:#D5C5B6",4.8,88,"65% Cotton 35% Polyester,Water-resistant finish,Dry clean only",30,https://example.com/product/city-chic-trench-coat
3,tailored-linen-trousers,Tailored Linen Trousers,130.00,"https://images.unsplash.com/photo-1612653705360-34f2a2e17098?crop=entropy&cs=tinysrgb&fit=max&fm=jpg&ixid=M3w3NDE5ODJ8MHwxfHNlYXJjaHw5fHxsaW5lbiUyMHRyb3VzZXJzfGVufDB8fHx8MTc1OTAwOTYwNXww&ixlib=rb-4.1.0&q=80&w=1080","Breatheable and effortlessly elegant, these trousers are your new warm-weather staple. Made from a high-quality linen blend, they feature a flattering high-waist and wide-leg cut.","Womens","New Arrival","XS,S,M,L,XL","Off-White:#FAFAF9,Beige:#D5C5B6",4.7,56,"70% Linen 30% Viscose,High-waisted wide-leg fit,Zip fly with hook-and-bar closure",60,https://example.com/product/tailored-linen-trousers
4,effortless-silk-blouse,Effortless Silk Blouse,160.00,"https://images.unsplash.com/photo-1756483496981-05b741fdd40a?crop=entropy&cs=tinysrgb&fit=max&fm=jpg&ixid=M3w3NDE5ODJ8MHwxfHNlYXJjaHw1fHxzaWxrJTIwYmxvdXNlfGVufDB8fHx8MTc1OTA4MDY0NHww&ixlib=rb-4.1.0&q=80&w=1080","The epitome of quiet luxury. Our Effortless Silk Blouse is made from 100% Mulberry silk, offering a fluid drape and a subtle sheen. A timeless piece for work or evening.","Womens","Featured,Best Seller","XS,S,M,L","Off-White:#FAFAF9,Burgundy:#800020",4.9,92,"100% 19mm Mulberry silk,Concealed button placket,Dry clean recommended",45,https://example.com/product/effortless-silk-blouse
5,modernist-wool-sweater,Modernist Wool Sweater,180.00,"https://images.unsplash.com/photo-1601379327928-bedfaf9da2d0?crop=entropy&cs=tinysrgb&fit=max&fm=jpg&ixid=M3w3NDE5ODJ8MHwxfHNlYXJjaHwyfHx3b29sJTIwc3dlYXRlcnxlbnwwfHx8fDE3NTkwMDEwNzN8MA&ixlib=rb-4.1.0&q=80&w=1080","A cozy yet sophisticated sweater crafted from responsibly sourced merino wool. The Modernist Sweater has a relaxed fit, a classic crew neck, and ribbed detailing for added texture.","Mens","Featured","S,M,L,XL","Soft Grey:#D1D5DB,Deep Burgundy:#800020",4.8,75,"100% RWS certified Merino wool,Relaxed fit,Hand wash cold",50,https://example.com/product/modernist-wool-sweater
6,versatile-denim-jacket,Versatile Denim Jacket,150.00,"https://images.unsplash.com/photo-1614697688184-66a55d41e298?crop=entropy&cs=tinysrgb&fit=max&fm=jpg&ixid=M3w3NDE5ODJ8MHwxfHNlYXJjaHw5fHxkZW5pbSUyMGphY2tldHxlbnwwfHx8fDE3NTkwMzU5NjN8MA&ixlib=rb-4.1.0&q=80&w=1080","A wardrobe staple that transcends seasons. Our Versatile Denim Jacket is made from organic cotton with a hint of stretch for comfort. The classic wash pairs with everything.","Mens","","S,M,L,XL","Classic Wash:#3B82F6",4.7,102,"98% Organic Cotton 2% Elastane,Classic non-stretch denim,Machine wash cold",80,https://example.com/product/versatile-denim-jacket
7,flowy-maxi-dress,Flowy Maxi Dress,190.00,"https://images.unsplash.com/photo-1692220438343-d054c8b7d7c0?crop=entropy&cs=tinysrgb&fit=max&fm=jpg&ixid=M3w3NDE5ODJ8MHwxfHNlYXJjaHw2fHxtYXhpJTIwZHJlc3N8ZW58MHx8fHwxNzU5MDkzOTUxfDA&ixlib=rb-4.1.0&q=80&w=1080","A statement piece for any special occasion. This maxi dress features a flattering V-neck, an adjustable waist tie, and a tiered skirt that moves beautifully with every step.","Womens","New Arrival","XS,S,M,L","Deep Burgundy:#800020",4.9,45,"100% Tencel™ Lyocell,V-neckline and flutter sleeves,Adjustable waist tie",25,https://example.com/product/flowy-maxi-dress
8,classic-oxford-shirt,Classic Oxford Shirt,110.00,"https://images.unsplash.com/photo-1720514496503-c399e2af61d2?crop=entropy&cs=tinysrgb&fit=max&fm=jpg&ixid=M3w3NDE5ODJ8MHwxfHNlYXJjaHwxMHx8b3hmb3JkJTIwc2hpcnR8ZW58MHx8fHwxNzU5MDkzOTUxfDA&ixlib=rb-4.1.0&q=80&w=1080","Sharp, timeless, and endlessly versatile. Our Classic Oxford Shirt is made from durable Oxford cloth that gets softer with every wash. A must-have for any man's wardrobe.","Mens","Best Seller","S,M,L,XL","White:#FFFFFF,Light Blue:#A5C9DE",4.8,150,"100% Cotton Oxford cloth,Button-down collar,Machine wash warm",120,https://example.com/product/classic-oxford-shirt
